SEP=,
Alert Name,Risk Level,Confidence,Description,Solution,Reference URL
CSP: Failure to Define Directive with No Fallback,2,High,The Content Security Policy fails to define one of the directives that has no fallback. Missing/excluding them is the same as allowing anything.,"Ensure that your web server, application server, load balancer, etc. is properly configured to set the Content-Security-Policy header.",https://www.zaproxy.org/docs/alerts/10055-13/
CSP: script-src unsafe-inline,2,High,"Content Security Policy (CSP) is an added layer of security that helps to detect and mitigate certain types of attacks. Including (but not limited to) Cross Site Scripting (XSS), and data injection attacks. These attacks are used for everything from data theft to site defacement or distribution of malware. CSP provides a set of standard HTTP headers that allow website owners to declare approved sources of content that browsers should be allowed to load on that page — covered types are JavaScript, CSS, HTML frames, fonts, images and embeddable objects such as Java applets, ActiveX, audio and video files.","Ensure that your web server, application server, load balancer, etc. is properly configured to set the Content-Security-Policy header.",https://www.zaproxy.org/docs/alerts/10055-5/
CSP: style-src unsafe-inline,2,High,"Content Security Policy (CSP) is an added layer of security that helps to detect and mitigate certain types of attacks. Including (but not limited to) Cross Site Scripting (XSS), and data injection attacks. These attacks are used for everything from data theft to site defacement or distribution of malware. CSP provides a set of standard HTTP headers that allow website owners to declare approved sources of content that browsers should be allowed to load on that page — covered types are JavaScript, CSS, HTML frames, fonts, images and embeddable objects such as Java applets, ActiveX, audio and video files.","Ensure that your web server, application server, load balancer, etc. is properly configured to set the Content-Security-Policy header.",https://www.zaproxy.org/docs/alerts/10055-6/
Authentication Request Identified,0,High,"The given request has been identified as an authentication request. The 'Other Info' field contains a set of key=value lines which identify any relevant fields. If the request is in a context which has an Authentication Method set to ""Auto-Detect"" then this rule will change the authentication to match the request identified.",This is an informational alert rather than a vulnerability and so there is nothing to fix.,https://www.zaproxy.org/docs/alerts/10111/
Non-Storable Content,0,Medium,"The response contents are not storable by caching components such as proxy servers. If the response does not contain sensitive, personal or user-specific information, it may benefit from being stored and cached, to improve performance.","The content may be marked as storable by ensuring that the following conditions are satisfied:The request method must be understood by the cache and defined as being cacheable (""GET"", ""HEAD"", and ""POST"" are currently defined as cacheable)The response status code must be understood by the cache (one of the 1XX, 2XX, 3XX, 4XX, or 5XX response classes are generally understood)The ""no-store"" cache directive must not appear in the request or response header fieldsFor caching by ""shared"" caches such as ""proxy"" caches, the ""private"" response directive must not appear in the responseFor caching by ""shared"" caches such as ""proxy"" caches, the ""Authorization"" header field must not appear in the request, unless the response explicitly allows it (using one of the ""must-revalidate"", ""public"", or ""s-maxage"" Cache-Control response directives)In addition to the conditions above, at least one of the following conditions must also be satisfied by the response:It must contain an ""Expires"" header fieldIt must contain a ""max-age"" response directiveFor ""shared"" caches such as ""proxy"" caches, it must contain a ""s-maxage"" response directiveIt must contain a ""Cache Control Extension"" that allows it to be cachedIt must have a status code that is defined as cacheable by default (200, 203, 204, 206, 300, 301, 404, 405, 410, 414, 501).",https://www.zaproxy.org/docs/alerts/10049-1/
Session Management Response Identified,0,Medium,"The given response has been identified as containing a session management token. The 'Other Info' field contains a set of header tokens that can be used in the Header Based Session Management Method. If the request is in a context which has a Session Management Method set to ""Auto-Detect"" then this rule will change the session management to use the tokens identified.",This is an informational alert rather than a vulnerability and so there is nothing to fix.,https://www.zaproxy.org/docs/alerts/10112/
User Controllable HTML Element Attribute (Potential XSS),0,Low,This check looks at user-supplied input in query string parameters and POST data to identify where certain HTML attribute values might be controlled. This provides hot-spot detection for XSS (cross-site scripting) that will require further review by a security analyst to determine exploitability.,Validate all input and sanitize output it before writing to any HTML attributes.,https://www.zaproxy.org/docs/alerts/10031/